paper,subsection,type,main_content,context,outcome
An ultrasensitive method for detection of cell-free RNA,Application to non-malignant conditions,Q1.1,"...we explored whether RARE-seq might have 
utility for simultaneously tracking RNA-based treatments and their 
effects on the host. To do so, ","Separately, given the rapidly growing interest in RNA-based vaccines and therapeutics, ","we longitudinally profiled plasma from 
five individuals receiving mRNA-based COVID-19 vaccinations (n = 20 
timepoints). We performed RARE-seq on these samples using the RAG 
capture panel supplemented with baits targeting the sequence of the 
mRNA vaccine (Extended Data Fig. 3c)."
"Whole-genome landscapes of 1,364 breast cancers",Mutational landscapes and cancer drivers,Q2.3,"BCL11B, ... was mutated in 23 patients at much higher frequency than random expectation.","which encodes a transcription factor that is involved in chromatic remodelling, gene regulation and mammary stem cell self-renewal18,19, ",N/A